<?xml version="1.0"?>
<xs:schema xmlns:xs="http://www.w3.org/2001/XMLSchema">

<xs:element name="orders">
    <xs:complexType>
        <xs:sequence>
            <xs:element name="order" maxOccurs="unbounded">
                <xs:complexType>
                    <xs:sequence>
                        <xs:element name="customer">
                            <xs:complexType>
                                <xs:sequence>
                                    <xs:element name="name" type="xs:string"></xs:element>
                                    <xs:element name="email" type="xs:string"></xs:element>
                                </xs:sequence>
                            </xs:complexType>
                        </xs:element>
                        <xs:element name="items">
                            <xs:complexType>
                                <xs:sequence>
                                    <xs:element name="item" maxOccurs="unbounded">
                                        <xs:complexType>
                                            <xs:sequence>
                                                <xs:element name="name" type="xs:string"></xs:element>
                                                <xs:element name="quantity">
                                                    <xs:simpleType>
                                                        <xs:restriction base="xs:integer">
                                                            <xs:minInclusive value="0"/>
                                                        </xs:restriction>
                                                    </xs:simpleType>
                                                </xs:element>
                                                <xs:element name="price">
                                                    <xs:simpleType>
                                                        <xs:restriction base="xs:double">
                                                            <xs:minInclusive value="0"/>
                                                        </xs:restriction>
                                                    </xs:simpleType>
                                                </xs:element>
                                            </xs:sequence>
                                        </xs:complexType>
                                    </xs:element>
                                </xs:sequence>
                            </xs:complexType>
                        </xs:element>
                        <xs:element name="date" type="xs:date"/>
                    </xs:sequence>
                    <xs:attribute name="id" type="xs:string"/>
                    <xs:attribute name="status">
                        <xs:simpleType>
                            <xs:restriction base="xs:string">
                                <xs:enumeration value="pending"></xs:enumeration>
                                <xs:enumeration value="completed"></xs:enumeration>
                            </xs:restriction>
                        </xs:simpleType>
                    </xs:attribute>
                </xs:complexType>
            </xs:element>
        </xs:sequence>
    </xs:complexType>
</xs:element>

</xs:schema>